[
 {
  "id": "A1909-7:Page 2:0",
  "act_id": "A1909-7",
  "page_or_anchor": "Page 2",
  "footnote_number": 1,
  "raw_text": "1.  The  Act  has  extended  to  Dadra  and  Nagar  Haveli  by  Reg.  6  of  1963,  s.  2  and  first  Schedu le(w.e.f. 1-7-1965).",
  "amendment_type": "other",
  "amending_act_citation": null,
  "amending_year": null,
  "wef_date": "1965-07-01"
 },
 {
  "id": "A1909-7:Page 2:1",
  "act_id": "A1909-7",
  "page_or_anchor": "Page 2",
  "footnote_number": 2,
  "raw_text": "2.  The  words  “except  the  State  of  Jammu  and  Kashmir”  omitted  by  Act  34  of  2019,  s.  95  and  the  Fifth  Schedule(w.e.f. 31-10- 2019).",
  "amendment_type": "other",
  "amending_act_citation": "Act  34  of  2019",
  "amending_year": 2019,
  "wef_date": null
 },
 {
  "id": "A1909-7:Page 2:2",
  "act_id": "A1909-7",
  "page_or_anchor": "Page 2",
  "footnote_number": 3,
  "raw_text": "3. Ins. by Act 29 of 2012, s. 2 (w.e.f. 1-11-2013).",
  "amendment_type": "insertion",
  "amending_act_citation": "Act 29 of 2012",
  "amending_year": 2012,
  "wef_date": "2013-11-01"
 },
 {
  "id": "A1909-7:Page 2:3",
  "act_id": "A1909-7",
  "page_or_anchor": "Page 2",
  "footnote_number": 4,
  "raw_text": "4. Ins. by s. 3, ibid. (w.e.f. 1-11-2013).",
  "amendment_type": "insertion",
  "amending_act_citation": null,
  "amending_year": null,
  "wef_date": "2013-11-01"
 },
 {
  "id": "A1860-45:Page 14:0",
  "act_id": "A1860-45",
  "page_or_anchor": "Page 14",
  "footnote_number": 1,
  "raw_text": "1. The Indian Penal Code has been extended to Berar by the Berar Laws Act, 1941 (4 of 1941) and has been declared in forcein—SonthalParganas, by the SonthalParganas Settlement Regulation 1872 (3 of 1872) s. 2;PanthPiploda, by the PanthPiploda Laws Regulation, 1929 (1 of 1929), s. 2 and the Sch.;Khondmals District, by the Khondmals Laws Regulation, 1936 (4 of 1936), s. 3 and the Sch; andAngul District, by the Angul Laws Regulation, 1936 (5 of 1936), s. 3 and the Sch.It has been declared under s. 3 (a) of the Scheduled Districts Act, 1874 (14 of 1874), to be in force in the followingScheduled Districts, namely: the United Provinces TaraiDistricts, see Gazette of India, 1876, Pt. I, p. 505; the Districts ofHazaribagh,  Lohardaga  [now  called  the  Ranchi  District,  see  Calcutta  Gazetta,  1899,  Pt.  I,  p.  44]  and  Manbhum  andParganaDhalbhum and the Kolhan in the District of Singhbum—see Gazette of India, 1881, Pt. I, p. 504.It has been extended under s. 5 of the same Act to the Lushai Hills—see Gazette of India, 1898, Pt. II, p. 345.The Act has been extended to Goa, Daman and Diu by Reg. 12 of 1962, s. 3 and Sch; to Dadra and Nagar Haveli by Reg. 6 of1963, s. 2 and Sch. I.; to Pondicherry by Reg. 7 of 1963, s. 3 and Sch. I and to Lakshadweep by Reg. 8 of 1965, s. 3 and Sch.",
  "amendment_type": "extension",
  "amending_act_citation": null,
  "amending_year": null,
  "wef_date": null
 },
 {
  "id": "A1860-45:Page 14:1",
  "act_id": "A1860-45",
  "page_or_anchor": "Page 14",
  "footnote_number": 2,
  "raw_text": "2. The words “British India” have successively been subs. by the A.O. 1948, the A.O. 1950 and Act 3 of 1951, s. 3 and the Sch.,to read as above.",
  "amendment_type": "substitution",
  "amending_act_citation": "Act 3 of 1951",
  "amending_year": 1951,
  "wef_date": null
 },
 {
  "id": "A1860-45:Page 14:2",
  "act_id": "A1860-45",
  "page_or_anchor": "Page 14",
  "footnote_number": 3,
  "raw_text": "3. The Original words have successively been amended by Act 12 of 1891, s. 2 and Sch. I, the A.O. 1937, the A.O. 1948 and theA.O. 1950 to read as above.",
  "amendment_type": "other",
  "amending_act_citation": "Act 12 of 1891",
  "amending_year": 1891,
  "wef_date": null
 },
 {
  "id": "A1860-45:Page 14:3",
  "act_id": "A1860-45",
  "page_or_anchor": "Page 14",
  "footnote_number": 4,
  "raw_text": "4. The words “except the State of Jammu and Kashmir” omitted by Act 34 of 2019, s. 95 and the Fifth Schedule(w.e.f. 31-10- 2019).",
  "amendment_type": "omission",
  "amending_act_citation": "Act 34 of 2019",
  "amending_year": 2019,
  "wef_date": null
 },
 {
  "id": "A1860-45:Page 14:4",
  "act_id": "A1860-45",
  "page_or_anchor": "Page 14",
  "footnote_number": 5,
  "raw_text": "5. The original words “the said territories” have successively been amended by the A.O. 1937, the A.O. 1948, the A.O 1950 andAct 3 of 1951, s. 3 and the Sch., to read as above.",
  "amendment_type": "other",
  "amending_act_citation": "Act 3 of 1951",
  "amending_year": 1951,
  "wef_date": null
 },
 {
  "id": "A1860-45:Page 14:5",
  "act_id": "A1860-45",
  "page_or_anchor": "Page 14",
  "footnote_number": 6,
  "raw_text": "6. The words and figures “on or after the said first day of May, 1861” rep. by Act 12 of 1891, s. 2 and the First Sch.",
  "amendment_type": "other",
  "amending_act_citation": "Act 12 of 1891",
  "amending_year": 1891,
  "wef_date": null
 },
 {
  "id": "A1860-45:Page 14:6",
  "act_id": "A1860-45",
  "page_or_anchor": "Page 14",
  "footnote_number": 7,
  "raw_text": "7. Subs. by the A.O. 1937, for “law passed by the Governor General of India in Council”.",
  "amendment_type": "substitution",
  "amending_act_citation": null,
  "amending_year": null,
  "wef_date": null
 },
 {
  "id": "A1860-45:Page 14:7",
  "act_id": "A1860-45",
  "page_or_anchor": "Page 14",
  "footnote_number": 8,
  "raw_text": "8.  The  Original  words  “the  limits  of  the  said  territories”  have  successively  been  amended  by  the  A.O.  1937,  the  A.O.1948,the A.O. 1950 and Act 3 of 1951, s. 3 and the Sch., to read as above.",
  "amendment_type": "other",
  "amending_act_citation": "Act 3 of 1951",
  "amending_year": 1951,
  "wef_date": null
 },
 {
  "id": "A1860-45:Page 14:8",
  "act_id": "A1860-45",
  "page_or_anchor": "Page 14",
  "footnote_number": 9,
  "raw_text": "9. Subs. by Act 4 of 1898, s. 2, for section 4.10. Subs. by the A.O. 1950, for cls. (1) to (4).11. Ins. by Act 10 of 2009, s. 51 (w.e.f. 27-10-2009).12. Subs. by s. 51, ibid., for the Explanation (w.e.f. 27-10-2009).",
  "amendment_type": "insertion",
  "amending_act_citation": "Act 4 of 1898",
  "amending_year": 1898,
  "wef_date": "2009-10-27"
 },
 {
  "id": "A1860-45:Page 15:0",
  "act_id": "A1860-45",
  "page_or_anchor": "Page 15",
  "footnote_number": 1,
  "raw_text": "1. Subs. by Act 36 of 1957, s. 3 and Schedule II, for “lllustrations”",
  "amendment_type": "substitution",
  "amending_act_citation": "Act 36 of 1957",
  "amending_year": 1957,
  "wef_date": null
 },
 {
  "id": "A1860-45:Page 15:1",
  "act_id": "A1860-45",
  "page_or_anchor": "Page 15",
  "footnote_number": 2,
  "raw_text": "2. The brackets and letter “(a)” omitted by s. 3 and the Second Sch., ibid.",
  "amendment_type": "omission",
  "amending_act_citation": null,
  "amending_year": null,
  "wef_date": null
 },
 {
  "id": "A1860-45:Page 15:2",
  "act_id": "A1860-45",
  "page_or_anchor": "Page 15",
  "footnote_number": 3,
  "raw_text": "3. Subs. by the A.O. 1948, for “a coolie, who is a Native Indian subject”",
  "amendment_type": "substitution",
  "amending_act_citation": null,
  "amending_year": null,
  "wef_date": null
 },
 {
  "id": "A1860-45:Page 15:3",
  "act_id": "A1860-45",
  "page_or_anchor": "Page 15",
  "footnote_number": 4,
  "raw_text": "4. Subs. by the A.O. 1950, for “a British subject of Indian domicile”.",
  "amendment_type": "substitution",
  "amending_act_citation": null,
  "amending_year": null,
  "wef_date": null
 },
 {
  "id": "A1860-45:Page 15:4",
  "act_id": "A1860-45",
  "page_or_anchor": "Page 15",
  "footnote_number": 5,
  "raw_text": "5.  The  words  “British  India”  have  been  successively  amended  by  the  A.O.  1948,  the  A.O.  1950  and  Act  3  of  1951,  s.  3  andthe Sch., to read as above.",
  "amendment_type": "other",
  "amending_act_citation": "Act  3  of  1951",
  "amending_year": 1951,
  "wef_date": null
 },
 {
  "id": "A1860-45:Page 15:5",
  "act_id": "A1860-45",
  "page_or_anchor": "Page 15",
  "footnote_number": 6,
  "raw_text": "6. Illustrations (b), (c) and (d) omitted by the A.O. 1950.",
  "amendment_type": "omission",
  "amending_act_citation": null,
  "amending_year": null,
  "wef_date": null
 },
 {
  "id": "A1860-45:Page 15:6",
  "act_id": "A1860-45",
  "page_or_anchor": "Page 15",
  "footnote_number": 7,
  "raw_text": "7. Subs., ibid., for section 5.",
  "amendment_type": "other",
  "amending_act_citation": null,
  "amending_year": null,
  "wef_date": null
 },
 {
  "id": "A1860-45:Page 15:7",
  "act_id": "A1860-45",
  "page_or_anchor": "Page 15",
  "footnote_number": 8,
  "raw_text": "8. Subs., ibid., for section 14.",
  "amendment_type": "other",
  "amending_act_citation": null,
  "amending_year": null,
  "wef_date": null
 },
 {
  "id": "A2023-45:Section 2.:0",
  "act_id": "A2023-45",
  "page_or_anchor": "Section 2.",
  "footnote_number": 1,
  "raw_text": "1. 1st day of July, 2024, except the provision of sub-section (2) of section 106, vide notification No. S.O. 850(E), dated, 23rd February, 2024, see Gazette of India, Extraordinary, Part II, sec. 3(ii).",
  "amendment_type": "other",
  "amending_act_citation": null,
  "amending_year": null,
  "wef_date": null
 }
]
